{
  "$schema": "./profile.schema.json",
  "schema_version": 1,
  "astra_available": false,
  "opus_available": false,
  "fable_available": false,
  "claude_extra_usage_off": false,
  "version_timestamp": "2026-10-05 19:34:30 AST",
  "name": "Example team member",
  "role": "developer",
  "goals": [
    "build reliable web applications",
    "review changes before release"
  ],
  "stack": [
    "TypeScript",
    "Next.js"
  ],
  "privacy": "internal",
  "ides": [
    "codex",
    "claude",
    "cursor"
  ],
  "subscriptions": {
    "chatgpt": true,
    "claude": false,
    "openrouter_free": false
  },
  "app_quality_first": false,
  "sol_current_available": false,
  "opus_current_available": false
}
